{
  "schemaVersion": 1,
  "units": {
    "length": "mm",
    "mass": "kg",
    "force": "N",
    "angle": "deg",
    "time": "s"
  },
  "coordinateConvention": "Z up; define machine X/Y orientation before assembly modeling.",
  "targetEnvelope": {
    "x": null,
    "y": null,
    "z": null,
    "units": "mm",
    "status": "unspecified"
  },
  "part": {
    "part_id": "PART-CONTROL",
    "name": "CNC control and electrical system",
    "description": "LinuxCNC/Mesa motion control, THC sensing, wiring, and cabinet.",
    "role": "Controls motion, torch interface, and height sensing.",
    "status": "candidate",
    "priority": "9",
    "model_type": "assembly",
    "primary_datum": "cabinet-datum",
    "target_envelope_x": null,
    "target_envelope_y": null,
    "target_envelope_z": null,
    "spec_notes": "Electrical layout and exact Mesa boards are not verified. Treat as a non-geometric assembly until detailed requirements exist.",
    "reference_ids": "REF-CONTROL"
  },
  "features": [
    {
      "feature_id": "FEAT-CONTROL-THC",
      "part_id": "PART-CONTROL",
      "name": "Torch height sensing",
      "description": "Arc voltage and ohmic sensing front-end.",
      "required": "yes",
      "feature_kind": "electrical-interface",
      "dimensions_or_intent": "Mesa THCAD-10 arc voltage and THCAD-5 touch-off are documented selection.",
      "interface_name": "THCInterface",
      "constraint_ids": "CON-CTRL",
      "status": "draft",
      "notes": "High-voltage interface must follow manufacturer documentation; CAD model is schematic only.",
      "constraints": [
        {
          "constraint_id": "CON-CTRL",
          "scope": "device",
          "target_id": null,
          "name": "Motion/control stack",
          "operator": "=",
          "value": "LinuxCNC Qtplasmac + Mesa 7i76e + THCAD-5/10",
          "minimum": null,
          "maximum": null,
          "units": null,
          "priority": "preferred",
          "status": "draft",
          "rationale": "Architecture captured in notes; verify exact Mesa hardware inventory.",
          "source_ref": "REF-CONTROL"
        }
      ]
    },
    {
      "feature_id": "FEAT-CONTROL-MOTION",
      "part_id": "PART-CONTROL",
      "name": "Motion controller",
      "description": "LinuxCNC/Mesa control stack for coordinated motion.",
      "required": "yes",
      "feature_kind": "electrical-interface",
      "dimensions_or_intent": "LinuxCNC Qtplasmac and Mesa 7i76e documented direction.",
      "interface_name": "MotionIO",
      "constraint_ids": "CON-CTRL",
      "status": "draft",
      "notes": "Verify exact board inventory and I/O mapping.",
      "constraints": [
        {
          "constraint_id": "CON-CTRL",
          "scope": "device",
          "target_id": null,
          "name": "Motion/control stack",
          "operator": "=",
          "value": "LinuxCNC Qtplasmac + Mesa 7i76e + THCAD-5/10",
          "minimum": null,
          "maximum": null,
          "units": null,
          "priority": "preferred",
          "status": "draft",
          "rationale": "Architecture captured in notes; verify exact Mesa hardware inventory.",
          "source_ref": "REF-CONTROL"
        }
      ]
    }
  ],
  "constraints": [],
  "references": [
    {
      "reference_id": "REF-CONTROL",
      "part_id": "PART-CONTROL",
      "path": "calc/control-architecture.md",
      "document_type": "architecture-note",
      "description": "LinuxCNC, Mesa, and THC architecture.",
      "authority": "engineering-note",
      "notes": "Verify hardware inventory and electrical implementation."
    }
  ],
  "provenance": {
    "workbook": "AI_CAD/workflow.xlsx",
    "sheets": [
      "Parts",
      "Features",
      "Constraints",
      "References"
    ]
  }
}
