{
  "schemaVersion": 1,
  "units": {
    "length": "mm",
    "mass": "kg",
    "force": "N",
    "angle": "deg",
    "time": "s"
  },
  "coordinateConvention": "Z up; define machine X/Y orientation before assembly modeling.",
  "targetEnvelope": {
    "x": null,
    "y": null,
    "z": null,
    "units": "mm",
    "status": "unspecified"
  },
  "part": {
    "part_id": "PART-DRILL",
    "name": "Manual-change drill spindle head",
    "description": "Optional drill/spindle tool head with separate motor and belt-driven spindle concept.",
    "role": "Future drilling and light machining tool.",
    "status": "candidate",
    "priority": "8",
    "model_type": "assembly",
    "primary_datum": "spindle-axis-datum",
    "target_envelope_x": null,
    "target_envelope_y": null,
    "target_envelope_z": null,
    "spec_notes": "2.5 mm Z screw and Flipsky spindle motor are concepts in notes; do not combine the plasma Z and drilling Z until architecture is decided.",
    "reference_ids": "REF-Z-CALC;REF-FLIPSKY"
  },
  "features": [
    {
      "feature_id": "FEAT-DRILL-SPINDLE",
      "part_id": "PART-DRILL",
      "name": "Drill spindle",
      "description": "Optional spindle for small-hole drilling and light machining.",
      "required": "no",
      "feature_kind": "spindle",
      "dimensions_or_intent": "6 mm maximum tool; target about 1300 rpm from sizing notes.",
      "interface_name": "SpindleAxis",
      "constraint_ids": null,
      "status": "draft",
      "notes": "Tool, bearing, and interface architecture unresolved.",
      "constraints": []
    },
    {
      "feature_id": "FEAT-DRILL-Z",
      "part_id": "PART-DRILL",
      "name": "Drill feed axis",
      "description": "Optional high-force Z feed for drilling.",
      "required": "no",
      "feature_kind": "linear-drive",
      "dimensions_or_intent": "2.5 mm self-locking lead screw concept; design feed 2000 N.",
      "interface_name": "DrillZAxis",
      "constraint_ids": "CON-Z-FEED",
      "status": "draft",
      "notes": "Do not merge with plasma torch Z without explicit architecture decision.",
      "constraints": [
        {
          "constraint_id": "CON-Z-FEED",
          "scope": "device",
          "target_id": null,
          "name": "Z drilling design feed force",
          "operator": ">=",
          "value": 2000,
          "minimum": null,
          "maximum": null,
          "units": "N",
          "priority": "preferred",
          "status": "draft",
          "rationale": "Design value applies to Z drilling, not X/Y axes.",
          "source_ref": "REF-Z-CALC"
        }
      ]
    }
  ],
  "constraints": [],
  "references": [
    {
      "reference_id": "REF-Z-CALC",
      "part_id": "PART-DRILL",
      "path": "calc/z-axis-spindle.md",
      "document_type": "engineering-calculation",
      "description": "Drilling Z and optional spindle concept.",
      "authority": "engineering-note",
      "notes": "Concept calculations only."
    },
    {
      "reference_id": "REF-FLIPSKY",
      "part_id": "PART-DRILL",
      "path": "drawings/flipsky_7070_140kv_spec.md",
      "document_type": "vendor-reference-summary",
      "description": "Optional BLDC spindle motor dimensions and specifications.",
      "authority": "research-summary",
      "notes": "Motor suitability and actual variant need confirmation."
    }
  ],
  "provenance": {
    "workbook": "AI_CAD/workflow.xlsx",
    "sheets": [
      "Parts",
      "Features",
      "Constraints",
      "References"
    ]
  }
}
