{
  "schemaVersion": 1,
  "units": {
    "length": "mm",
    "mass": "kg",
    "force": "N",
    "angle": "deg",
    "time": "s"
  },
  "coordinateConvention": "Z up; define machine X/Y orientation before assembly modeling.",
  "targetEnvelope": {
    "x": null,
    "y": null,
    "z": null,
    "units": "mm",
    "status": "unspecified"
  },
  "part": {
    "part_id": "PART-TANK",
    "name": "Water tank and pan",
    "description": "Welded water-table pan with base and four side walls.",
    "role": "Supports workpiece and contains cutting water.",
    "status": "specified-draft",
    "priority": "1",
    "model_type": "single-solid",
    "primary_datum": "bottom-outside-center",
    "target_envelope_x": null,
    "target_envelope_y": null,
    "target_envelope_z": null,
    "spec_notes": "Internal dimensions currently documented as 1712 x 1712 x 140 mm; verify assembly clearances and weld design.",
    "reference_ids": "REF-README"
  },
  "features": [
    {
      "feature_id": "FEAT-TANK-BASE",
      "part_id": "PART-TANK",
      "name": "Tank base plate",
      "description": "Flat 6 mm plate forming the bottom of the water pan.",
      "required": "yes",
      "feature_kind": "plate",
      "dimensions_or_intent": "1712 x 1712 mm internal dimensions; outside size and bend/weld allowance need definition.",
      "interface_name": null,
      "constraint_ids": "CON-TANK-INTERNAL-W;CON-TANK-INTERNAL-L;CON-TANK-PLATE",
      "status": "draft",
      "notes": "Geometry must distinguish inside dimensions from outside dimensions.",
      "constraints": [
        {
          "constraint_id": "CON-TANK-INTERNAL-W",
          "scope": "part",
          "target_id": "PART-TANK",
          "name": "Tank internal width",
          "operator": "=",
          "value": 1712,
          "minimum": null,
          "maximum": null,
          "units": "mm",
          "priority": "hard",
          "status": "draft",
          "rationale": "Documented square water-table interior; reconcile with rectangular machine envelope.",
          "source_ref": "REF-README"
        },
        {
          "constraint_id": "CON-TANK-INTERNAL-L",
          "scope": "part",
          "target_id": "PART-TANK",
          "name": "Tank internal length",
          "operator": "=",
          "value": 1712,
          "minimum": null,
          "maximum": null,
          "units": "mm",
          "priority": "hard",
          "status": "draft",
          "rationale": "Documented tank is square; sheet support and machine envelope require confirmation.",
          "source_ref": "REF-README"
        },
        {
          "constraint_id": "CON-TANK-PLATE",
          "scope": "part",
          "target_id": "PART-TANK",
          "name": "Tank plate thickness",
          "operator": "=",
          "value": 6,
          "minimum": null,
          "maximum": null,
          "units": "mm",
          "priority": "hard",
          "status": "draft",
          "rationale": "Documented plate thickness; steel grade unspecified.",
          "source_ref": "REF-README"
        }
      ]
    },
    {
      "feature_id": "FEAT-TANK-WALLS",
      "part_id": "PART-TANK",
      "name": "Tank side walls",
      "description": "Four walls enclosing the water pan.",
      "required": "yes",
      "feature_kind": "wall",
      "dimensions_or_intent": "140 mm internal depth; wall joints and corner details unresolved.",
      "interface_name": null,
      "constraint_ids": "CON-TANK-DEPTH;CON-TANK-PLATE",
      "status": "draft",
      "notes": "Do not infer weld prep or watertight construction details.",
      "constraints": [
        {
          "constraint_id": "CON-TANK-DEPTH",
          "scope": "part",
          "target_id": "PART-TANK",
          "name": "Internal tank depth",
          "operator": "=",
          "value": 140,
          "minimum": null,
          "maximum": null,
          "units": "mm",
          "priority": "hard",
          "status": "draft",
          "rationale": "Current documented depth; water mass implications need updated lift analysis.",
          "source_ref": "REF-README"
        },
        {
          "constraint_id": "CON-TANK-PLATE",
          "scope": "part",
          "target_id": "PART-TANK",
          "name": "Tank plate thickness",
          "operator": "=",
          "value": 6,
          "minimum": null,
          "maximum": null,
          "units": "mm",
          "priority": "hard",
          "status": "draft",
          "rationale": "Documented plate thickness; steel grade unspecified.",
          "source_ref": "REF-README"
        }
      ]
    },
    {
      "feature_id": "FEAT-TANK-DRAIN",
      "part_id": "PART-TANK",
      "name": "Drain outlet",
      "description": "Low-point outlet for draining water and dross.",
      "required": "yes",
      "feature_kind": "port",
      "dimensions_or_intent": "At lowest floor-pan point; port size and valve interface TBD.",
      "interface_name": "DrainPort",
      "constraint_ids": null,
      "status": "open",
      "notes": "Exact outlet orientation must be clarified before detailed CAD.",
      "constraints": []
    }
  ],
  "constraints": [
    {
      "constraint_id": "CON-TANK-INTERNAL-W",
      "scope": "part",
      "target_id": "PART-TANK",
      "name": "Tank internal width",
      "operator": "=",
      "value": 1712,
      "minimum": null,
      "maximum": null,
      "units": "mm",
      "priority": "hard",
      "status": "draft",
      "rationale": "Documented square water-table interior; reconcile with rectangular machine envelope.",
      "source_ref": "REF-README"
    },
    {
      "constraint_id": "CON-TANK-INTERNAL-L",
      "scope": "part",
      "target_id": "PART-TANK",
      "name": "Tank internal length",
      "operator": "=",
      "value": 1712,
      "minimum": null,
      "maximum": null,
      "units": "mm",
      "priority": "hard",
      "status": "draft",
      "rationale": "Documented tank is square; sheet support and machine envelope require confirmation.",
      "source_ref": "REF-README"
    },
    {
      "constraint_id": "CON-TANK-DEPTH",
      "scope": "part",
      "target_id": "PART-TANK",
      "name": "Internal tank depth",
      "operator": "=",
      "value": 140,
      "minimum": null,
      "maximum": null,
      "units": "mm",
      "priority": "hard",
      "status": "draft",
      "rationale": "Current documented depth; water mass implications need updated lift analysis.",
      "source_ref": "REF-README"
    },
    {
      "constraint_id": "CON-TANK-PLATE",
      "scope": "part",
      "target_id": "PART-TANK",
      "name": "Tank plate thickness",
      "operator": "=",
      "value": 6,
      "minimum": null,
      "maximum": null,
      "units": "mm",
      "priority": "hard",
      "status": "draft",
      "rationale": "Documented plate thickness; steel grade unspecified.",
      "source_ref": "REF-README"
    }
  ],
  "references": [
    {
      "reference_id": "REF-README",
      "part_id": null,
      "path": "README.md",
      "document_type": "project-summary",
      "description": "Project brief, current envelope, water-table dimensions, and decision log.",
      "authority": "project-notes",
      "notes": "Contains a mixture of confirmed customer data and evolving design notes."
    },
    {
      "reference_id": "REF-BED-CAD",
      "part_id": "PART-TANK",
      "path": "drawings/PlasmaTable.FCStd",
      "document_type": "freecad-document",
      "description": "Existing FreeCAD document containing early tank/slat assembly geometry.",
      "authority": "project-model",
      "notes": "Open and inspect before reusing; it is not guaranteed to match this workbook exactly."
    }
  ],
  "provenance": {
    "workbook": "AI_CAD/workflow.xlsx",
    "sheets": [
      "Parts",
      "Features",
      "Constraints",
      "References"
    ]
  }
}
