{
  "schemaVersion": 1,
  "units": {
    "length": "mm",
    "mass": "kg",
    "force": "N",
    "angle": "deg",
    "time": "s"
  },
  "coordinateConvention": "Z up; define machine X/Y orientation before assembly modeling.",
  "targetEnvelope": {
    "x": null,
    "y": null,
    "z": null,
    "units": "mm",
    "status": "unspecified"
  },
  "part": {
    "part_id": "PART-FRAME",
    "name": "Table support frame and legs",
    "description": "Frame carrying tank, gantry loads, and lift reactions.",
    "role": "Supports table and provides structural interfaces.",
    "status": "candidate",
    "priority": "3",
    "model_type": "assembly",
    "primary_datum": "base-frame-origin",
    "target_envelope_x": null,
    "target_envelope_y": null,
    "target_envelope_z": null,
    "spec_notes": "Member sections, material, bracing, leveling feet, and loads are not specified.",
    "reference_ids": "REF-README"
  },
  "features": [
    {
      "feature_id": "FEAT-FRAME-MOUNTS",
      "part_id": "PART-FRAME",
      "name": "Tank mounting interfaces",
      "description": "Interfaces carrying tank and lift loads.",
      "required": "yes",
      "feature_kind": "mounting-interface",
      "dimensions_or_intent": "Locations, bolt pattern, and support method TBD.",
      "interface_name": "TankMount",
      "constraint_ids": null,
      "status": "open",
      "notes": "Must coordinate with tank shell and lift.",
      "constraints": []
    },
    {
      "feature_id": "FEAT-FRAME-GANTRY",
      "part_id": "PART-FRAME",
      "name": "Gantry rail interfaces",
      "description": "Reference surfaces for long-axis guide rails.",
      "required": "yes",
      "feature_kind": "mounting-interface",
      "dimensions_or_intent": "Rail spacing, straightness, and mounting arrangement TBD.",
      "interface_name": "LongAxisRailMount",
      "constraint_ids": null,
      "status": "open",
      "notes": "HG20 is a candidate series, not a released rail layout.",
      "constraints": []
    }
  ],
  "constraints": [],
  "references": [
    {
      "reference_id": "REF-README",
      "part_id": null,
      "path": "README.md",
      "document_type": "project-summary",
      "description": "Project brief, current envelope, water-table dimensions, and decision log.",
      "authority": "project-notes",
      "notes": "Contains a mixture of confirmed customer data and evolving design notes."
    }
  ],
  "provenance": {
    "workbook": "AI_CAD/workflow.xlsx",
    "sheets": [
      "Parts",
      "Features",
      "Constraints",
      "References"
    ]
  }
}
