{
  "schemaVersion": 1,
  "units": {
    "length": "mm",
    "mass": "kg",
    "force": "N",
    "angle": "deg",
    "time": "s"
  },
  "coordinateConvention": "Z up; define machine X/Y orientation before assembly modeling.",
  "targetEnvelope": {
    "x": null,
    "y": null,
    "z": null,
    "units": "mm",
    "status": "unspecified"
  },
  "part": {
    "part_id": "PART-SLAT",
    "name": "Replaceable slat grid",
    "description": "Interlocking support fingers with toothed workpiece-contact edges.",
    "role": "Supports sheet while allowing dross and water flow.",
    "status": "specified-draft",
    "priority": "2",
    "model_type": "multi-solid-part",
    "primary_datum": "tank-bottom-center",
    "target_envelope_x": null,
    "target_envelope_y": null,
    "target_envelope_z": null,
    "spec_notes": "40 mm deep; 3 mm thickness is a preferred revision from the older 2 mm note; max spacing 50 mm. Slot direction and tooth dimensions need confirmation.",
    "reference_ids": "REF-README"
  },
  "features": [
    {
      "feature_id": "FEAT-SLAT-TOOTH",
      "part_id": "PART-SLAT",
      "name": "Shark-tooth contact edge",
      "description": "Narrow peaks provide discrete sheet contact.",
      "required": "yes",
      "feature_kind": "profile",
      "dimensions_or_intent": "Tooth pitch, height, tip width, and manufacturable profile TBD.",
      "interface_name": "WorkpieceSupport",
      "constraint_ids": "CON-SLAT-THICKNESS;CON-SLAT-HEIGHT",
      "status": "draft",
      "notes": "README describes shark-tooth style; no dimensioned tooth profile.",
      "constraints": [
        {
          "constraint_id": "CON-SLAT-THICKNESS",
          "scope": "part",
          "target_id": "PART-SLAT",
          "name": "Slat thickness",
          "operator": "=",
          "value": 3,
          "minimum": null,
          "maximum": null,
          "units": "mm",
          "priority": "preferred",
          "status": "proposed",
          "rationale": "README notes 2 mm is flimsy and suggests 3 mm if available.",
          "source_ref": "REF-README"
        },
        {
          "constraint_id": "CON-SLAT-HEIGHT",
          "scope": "part",
          "target_id": "PART-SLAT",
          "name": "Slat depth",
          "operator": "=",
          "value": 40,
          "minimum": null,
          "maximum": null,
          "units": "mm",
          "priority": "hard",
          "status": "draft",
          "rationale": "Documented slat depth.",
          "source_ref": "REF-README"
        }
      ]
    },
    {
      "feature_id": "FEAT-SLAT-SLOTS",
      "part_id": "PART-SLAT",
      "name": "Interlocking slots",
      "description": "Crossing slots allow the two slat directions to interlock.",
      "required": "yes",
      "feature_kind": "slot",
      "dimensions_or_intent": "Slot depth and fit clearance TBD; one slot set is from bottom, the crossing set from top.",
      "interface_name": "SlatIntersection",
      "constraint_ids": "CON-SLAT-THICKNESS;CON-SLAT-HEIGHT",
      "status": "draft",
      "notes": "Slot pattern and slat count require definition.",
      "constraints": [
        {
          "constraint_id": "CON-SLAT-THICKNESS",
          "scope": "part",
          "target_id": "PART-SLAT",
          "name": "Slat thickness",
          "operator": "=",
          "value": 3,
          "minimum": null,
          "maximum": null,
          "units": "mm",
          "priority": "preferred",
          "status": "proposed",
          "rationale": "README notes 2 mm is flimsy and suggests 3 mm if available.",
          "source_ref": "REF-README"
        },
        {
          "constraint_id": "CON-SLAT-HEIGHT",
          "scope": "part",
          "target_id": "PART-SLAT",
          "name": "Slat depth",
          "operator": "=",
          "value": 40,
          "minimum": null,
          "maximum": null,
          "units": "mm",
          "priority": "hard",
          "status": "draft",
          "rationale": "Documented slat depth.",
          "source_ref": "REF-README"
        }
      ]
    },
    {
      "feature_id": "FEAT-SLAT-TOP",
      "part_id": "PART-SLAT",
      "name": "Slat elevation",
      "description": "Sets the slat peaks below the tank rim.",
      "required": "yes",
      "feature_kind": "datum",
      "dimensions_or_intent": "Top contact peak 25 mm below tank rim.",
      "interface_name": "SlatTopPlane",
      "constraint_ids": "CON-SLAT-TOP",
      "status": "draft",
      "notes": "Height is from tooth peaks, not slat root.",
      "constraints": [
        {
          "constraint_id": "CON-SLAT-TOP",
          "scope": "feature",
          "target_id": "FEAT-SLAT-TOP",
          "name": "Slat top below tank rim",
          "operator": "=",
          "value": 25,
          "minimum": null,
          "maximum": null,
          "units": "mm",
          "priority": "hard",
          "status": "draft",
          "rationale": "One groove height is intended to support the documented water-level modes.",
          "source_ref": "REF-README"
        }
      ]
    }
  ],
  "constraints": [
    {
      "constraint_id": "CON-SLAT-THICKNESS",
      "scope": "part",
      "target_id": "PART-SLAT",
      "name": "Slat thickness",
      "operator": "=",
      "value": 3,
      "minimum": null,
      "maximum": null,
      "units": "mm",
      "priority": "preferred",
      "status": "proposed",
      "rationale": "README notes 2 mm is flimsy and suggests 3 mm if available.",
      "source_ref": "REF-README"
    },
    {
      "constraint_id": "CON-SLAT-HEIGHT",
      "scope": "part",
      "target_id": "PART-SLAT",
      "name": "Slat depth",
      "operator": "=",
      "value": 40,
      "minimum": null,
      "maximum": null,
      "units": "mm",
      "priority": "hard",
      "status": "draft",
      "rationale": "Documented slat depth.",
      "source_ref": "REF-README"
    },
    {
      "constraint_id": "CON-SLAT-SPACING",
      "scope": "part",
      "target_id": "PART-SLAT",
      "name": "Maximum slat spacing",
      "operator": "<=",
      "value": 50,
      "minimum": null,
      "maximum": null,
      "units": "mm",
      "priority": "hard",
      "status": "draft",
      "rationale": "Documented maximum spacing.",
      "source_ref": "REF-README"
    }
  ],
  "references": [
    {
      "reference_id": "REF-README",
      "part_id": null,
      "path": "README.md",
      "document_type": "project-summary",
      "description": "Project brief, current envelope, water-table dimensions, and decision log.",
      "authority": "project-notes",
      "notes": "Contains a mixture of confirmed customer data and evolving design notes."
    }
  ],
  "provenance": {
    "workbook": "AI_CAD/workflow.xlsx",
    "sheets": [
      "Parts",
      "Features",
      "Constraints",
      "References"
    ]
  }
}
